{"bbox":[126.9984,37.5699,127.0006,37.5716],"clip":{"bbox":[126.998,37.5698,127.001,37.5716],"center":null,"radius_m":null},"count":11,"counts":{"building":6,"road":3,"road_area":2},"data_mode":"synthetic","features":[{"geometry":{"coordinates":[[[126.99862,37.5701],[126.99885,37.5701],[126.99885,37.57028],[126.99862,37.57028],[126.99862,37.5701]]],"type":"Polygon"},"id":"building:1","properties":{"bbox":[126.99862,37.5701,126.99885,37.57028],"layer":"building","name":null},"type":"Feature"},{"geometry":{"coordinates":[[[126.99893,37.57045],[126.99915,37.57045],[126.99915,37.57065],[126.99893,37.57065],[126.99893,37.57045]]],"type":"Polygon"},"id":"building:2","properties":{"bbox":[126.99893,37.57045,126.99915,37.57065],"layer":"building","name":null},"type":"Feature"},{"geometry":{"coordinates":[[[126.99945,37.57075],[126.99975,37.57075],[126.99975,37.57095],[126.99945,37.57095],[126.99945,37.57075]]],"type":"Polygon"},"id":"building:3","properties":{"bbox":[126.99945,37.57075,126.99975,37.57095],"layer":"building","name":null},"type":"Feature"},{"geometry":{"coordinates":[[[127.00015,37.57115],[127.00045,37.57115],[127.00045,37.57135],[127.00015,37.57135],[127.00015,37.57115]]],"type":"Polygon"},"id":"building:4","properties":{"bbox":[127.00015,37.57115,127.00045,37.57135],"layer":"building","name":null},"type":"Feature"},{"geometry":{"coordinates":[[[126.9995,37.57],[126.99975,37.57],[126.99975,37.57015],[126.9995,37.57015],[126.9995,37.57]]],"type":"Polygon"},"id":"building:5","properties":{"bbox":[126.9995,37.57,126.99975,37.57015],"layer":"building","name":null},"type":"Feature"},{"geometry":{"coordinates":[[[127.0001,37.5706],[127.0004,37.5706],[127.0004,37.5708],[127.0001,37.5708],[127.0001,37.5706]]],"type":"Polygon"},"id":"building:6","properties":{"bbox":[127.0001,37.5706,127.0004,37.5708],"layer":"building","name":null},"type":"Feature"},{"geometry":{"coordinates":[[[126.9992,37.5699],[126.99935,37.5699],[126.99935,37.5716],[126.9992,37.5716],[126.9992,37.5699]]],"type":"Polygon"},"id":"road_area:1","properties":{"bbox":[126.9992,37.5699,126.99935,37.5716],"layer":"road_area","name":null},"type":"Feature"},{"geometry":{"coordinates":[[[126.9984,37.57036],[127.0006,37.57036],[127.0006,37.57046],[126.9984,37.57046],[126.9984,37.57036]]],"type":"Polygon"},"id":"road_area:2","properties":{"bbox":[126.9984,37.57036,127.0006,37.57046],"layer":"road_area","name":null},"type":"Feature"},{"geometry":{"coordinates":[[126.999275,37.5699],[126.999275,37.5716]],"type":"LineString"},"id":"road:1","properties":{"bbox":[126.999275,37.5699,126.999275,37.5716],"layer":"road","name":"가상로"},"type":"Feature"},{"geometry":{"coordinates":[[126.9984,37.57041],[127.0006,37.57041]],"type":"LineString"},"id":"road:2","properties":{"bbox":[126.9984,37.57041,127.0006,37.57041],"layer":"road","name":"가상1길"},"type":"Feature"},{"geometry":{"coordinates":[[[126.9996,37.571],[126.9999,37.5712]],[[127.0,37.57125],[127.0003,37.5714]]],"type":"MultiLineString"},"id":"road:3","properties":{"bbox":[126.9996,37.571,127.0003,37.5714],"layer":"road","name":"가상2길"},"type":"Feature"}],"generated_at":"2026-09-27T09:00:00Z","j5basemap":"1.0.0","sources":[{"crs":{"datum_shift":null,"detected_from":"prj","ellipsoid":"GRS80","epsg":5186,"name":"KGD2002 / Central Belt 2010"},"dbf_sha256":"ca4537c4f80d87854d73f30949684e286dc111054070b57e00a52d36b01beecf","encoding":"cp949","fields":["BD_MGT_SN","GRO_FLO_CO","BULD_NM"],"file":"buildings.shp","geometry_version":"2026-09-01","layer":"building","license":"가상자료 (이용허락 해당 없음)","name":"가상 배경 도형 (synthetic)","name_field":null,"record_count":7,"shp_sha256":"09787709d75221fd6328a5583abbcfeff8f582c1e1db35f20417dd779334c813"},{"crs":{"datum_shift":null,"detected_from":"prj","ellipsoid":"GRS80","epsg":5186,"name":"KGD2002 / Central Belt 2010"},"dbf_sha256":"fe5a0628da255495bfc1293d1f2c56a8b47dc9126048f50e34dae166cb1fa2bd","encoding":"cp949","fields":["RW_SN","WDR_RD_CD"],"file":"road_areas.shp","geometry_version":"2026-09-01","layer":"road_area","license":"가상자료 (이용허락 해당 없음)","name":"가상 배경 도형 (synthetic)","name_field":null,"record_count":2,"shp_sha256":"e50b75d0e29e817f0c7c9a11f4a25d972024ef8a74f3b96b7dffeadfa1af1f11"},{"crs":{"datum_shift":null,"detected_from":"prj","ellipsoid":"GRS80","epsg":5186,"name":"KGD2002 / Central Belt 2010"},"dbf_sha256":"ada7d8ded282462f569bceb114ca2f538fa2a7c95ab037038a6f2d758f7bc49f","encoding":"cp949","fields":["RDS_MAN_NO","RN","ROAD_BT"],"file":"roads.shp","geometry_version":"2026-09-01","layer":"road","license":"가상자료 (이용허락 해당 없음)","name":"가상 배경 도형 (synthetic)","name_field":"RN","record_count":3,"shp_sha256":"b5f9cb23929d07fbd57218348e319ffd615d1d0a081658709e04d078965252d8"}],"type":"FeatureCollection","warnings":[]}
